Feed,Sentiment
حنونة هي القهوة حين تقدم لنا روحها في سبيل مزاجنا,Positive
تمرين نفسي جميل لمن يعاني من فوبيا الاماكن المرتفعه,Positive
دن دن دن داني دان كيفي كويتي فيصل اطلع برا,Positive
نامي على كتفي لا جاك الحزن أنا لك أمن و أمان,Positive
متبقي شهر واحد فقط لهؤلاء الأساطير الثلاثة ليعلنوا اعتزالهم كرة القدم الرياضة,Positive
أرى ب عينيك إمتداد ملامحي و بين أصابعك ألف إعزوفة تراقص مشاعري و تحتضن ترآنيمي,Positive
سبحان من يجبر خواطرنا حين يصدأ كل شيء ويحن علينا إذا قسى كل شيء سبحان من نحن بدونه لسنا بشيء وبه كل شيء سبحان الذي إذا ذكرته ذكرك,Positive
كل عام و انت بخير حبيبي ادامك الله فخرا للمستقبل الطلابي,Positive
جميل ان تفرح بمنجزاتك والأجمل ان يشاركك أحباءك وأصدقاءك ويبادلونك مشاعر الود والفرح كما أنتم احبتي أسكن الله الفرح قلوبكم,Positive
البر لا يبلى والذنب لا ينسى والديان لا يموت إعمل ما شئت كما تدين تدان أسعد الله صباحكم,Positive
ذكرني ف نفسي لما أغني كاريوكي و اسوي ايفكت,Positive
صوت فقيدي لاينسى وبسمته لاتغيب عن خيالي رحم الله وجه اشتقت اليه,Positive
فاصبر لحكم ربك فإنك بأعيننا ما أجمل ان يواسيك الله,Positive
قال الجنيد أربع ترفع العبد إلى أعلى الدرجات وإن قل عمله وعلمه الحلم والتواضع والسخاء وحسن الخلق وهو كمال الإيمان صباح الخير,Positive
الله يبارك فيك اسبوع اقل ما يقال عنه خورافي,Positive
اذكريني باول انفاس الفجر مع نسيم الصبح لاهب العطر ولا اكتمل وجه القمر واصبح بدر اذكريني واكتبي لي لو سطر,Positive
كلما ضاقت عليك نفسك لاتشتكي لأحد بل ردد ربي إني مسني الضر وأنت أرحم الراحمين صباح الخير,Positive
غامضة مره ومره مثل نور تجمعين الضد في كل الأمور,Positive
الصوره ليست من الفضاء الخارجي انها من داخل مدرجات التالته يمين,Positive
لا أعلم ابدا متى بدأ الأمر و كيف أحببتك لكنني سأضع ضحكتك إحتمالا,Positive
لك يا أمي دعوة قلبي أن يزهر قبرك ويمتلئ نور وضياء لك كل الحب وإن كنت لست أمام ناظري حب الأم لا يموت ابدا,Positive
افضل مسلسل تركي في التاريخ اتمنى النهاية تكون حزينة عشان يكتمل جمال المسلسل,Positive
لو فتحت لك أستار الغيب لأحببت حزنك ولو رأيت كيف يغرف للصابر غرفا من الثواب لانتشى قلبك وتلذذت بكل وخزة أل,Positive
لن تحصل على ما تريد بسهولة و لا حتى بصعوبة ريح نفسك,Positive
أجمل من أنسام الشتاء وبراده ملامحك من حسنها تفتح النفس,Positive
أصبحنا وأصبح الملك لله الله يوفقني ويوفق كل نفر فيكم قولوا أمين,Positive
أرجوك يا صديقي لا تتوقع مني أن اكون دوما جيدا وطيبا ومحبا هنالك أيام سأكون فيها باردا شارد الذهن صعب الفهم,Positive
طبيعتي ما انقل فرحتي إلى تويتر واكتفي بتغريده او تغريدتين لكن اليوم المعجزه تجبرك على الاحتفال بغزاره,Positive
و نؤمن أنك خير الورى و مسك الحياة و خير الأنام تفيض بحبك أرواحنا عليك الصلاة عليك السلام,Positive
يا مسخر الأقدار سخر لي من الأقدار ما تسر به نفسي وبشرني بما انتظره منك فأنك خير المبشرين,Positive
يعني كيف ذا ملامح وجهه ولا غلطه بسم الله عليه,Positive
لطالما عرفت شيئا واحدا وآمنت به أنني أعرف كيف أنجو في غمرة الأذى وأعرف دائما كيف أحافظ على استقامتي واتزاني في وجه كل ميل,Positive
سيظل سور الصين العظيم اعظم واجمل ما رات عيني,Positive
شتان مابين امس واليوم في اللعب امس كانت المتعه بأكملها واليوم ناس تصيح برشلونه يوفنتوس,Positive
ريمونتادا تغير المعنى والكلمه الى برشلونه فقط,Positive
عدو عينك تهديه جوال جيجا لا احد يشتري هدية من هالنوع,Positive
شعور يوجع لما تحس مكسور من داخل وتحتاج تبكي تاخذ نفس عميق وتقول لاوين ابكي انا اقوى من كذا,Positive
للراحلين بعيدا دون رجوع طبتم بنعيم الفردوس نزلا,Positive
لقد امتليء العالم ب بحنيتك عليا ياكابتن قلبي,Positive
لا يمكن إستلام الهدية إلا بعد تسعة أشهر لأني احملها لك في جوفي,Positive
بعضا مما عندكم يا جميلتي اصبري لي بس كم يوم,Positive
ولسا بننهبكم زيادة ونعطي وانتم صاغرين ومستضعفين بعد,Positive
أشعر وانا معك بأن لاشي مرئي وان الوقت كذبة وبأن الكون لنا وحدنا,Positive
من صفاتك الحلوه الهدوء وضبط النفس بين الساعة ص الى ص,Positive
ستفنى الأوجاع وتنطوي الالام عن قريب في مجرة ما,Positive
وألقيت عليك السلام فى صمت فكيف حالك يا كل حالى صاحب تويتر وفلورز للاربع,Positive
دع عنك عشق العاشقين فأنما خلق الغرام لحب آل محمد,Positive
كرستيانو رونالدو كلما تكبر الليالي وتصعب يظهر من بعيد ويصمت النقاد بايرن ميونخ ريال مدريد,Positive
أحسد البن ام فنجان قهوتها إن بات في يدها تكسوه بالقبل,Positive
ربي وإن فارقت هذه الدنيا أسكني جنتك مغفور الذنب,Positive
ياليت الدنيا بكل احوالها حلوة مثلك مثل عيونك نجوى كرم,Positive
نبئ عبادي أني أنا الغفور الرحيم لعلك تريح بها قلبا يتألم فسبحان من لا تأنس الأرواح إلا به ولا تطمئن القلوب إلا بذكره,Positive
شفت اكثر من فرحه بهدف برشلونه السادس لكن هذا احلاهم وافضلهم,Positive
إني لأتوق إلى رؤية خصومة ملهمة أكثر من ذلك السلام الباعث على الملل,Positive
دورة حياتي في صورة هذه حياتي بمعناها الحقيقي,Positive
المرأة التي ترآهآ قوية الشخصية هي في الوآقع أشد الإنآث رقة,Positive
في عيناك صباح آخر ليفأنت مدينتي وأنت حكايتي وأنت كل أشيائي,Positive
اجمل مافي الشوط الاول بعد الهدف منظر يشرح الصدر,Positive
مختاريان عن الهدف لقد تفاجأت ايضا لم ادرك انه رائع الا وقت ماعدت الى المنزل واعدته,Positive
الذي يحبك حقا هو الذي يرى فوضاك التي تعيشها ومزاجك المتقلب وصعوبة التعامل معك أحيانا ولكنه مع كل هذا يريدك أن تبقى في حياته,Positive
كلما حطيت بكفوفي كفوفك أشعر إن الأرض ماهي مستديرة,Positive
تتحدث كثيرا مع البشر ولا يتغير أي شيء ثم تتحدث مع الله قليلا فيتغير كل شيء تكلموا مع ربكم ادعوه يستجب لكم يارب وانت اعلم بالباقي,Positive
ومع كل صباحا جديد يتجدد فيه حبي العظيم لها,Positive
الريال اقرب من اي وقت مضى لليغا نقطة ويعود الريال ليتربع على عرش الليغا بعد غياب طويل اشتقنا يا ليغا,Positive
هل قلت اليوم لا إله إلا الله وحده لا شريك له له الملك وله الحمد وهو على كل شئ قدير,Positive
هنآك قلوب تنكر الجميل عند وجود البديل وهناك قلوب ترفض البديل مهمآ كآن جميل,Positive
ليت الآباء والامهات لا يشيخون ابدا ولا يمرضون ولا يحزنون,Positive
ربي اكتب لي ما أسعى لوصوله وفاجئني بتجاوز الصعوبات بسهولة واجعل من حلمي حقيقة يا كريم,Positive
لاتعذب القلب لا عذب على كيفك عذابك ارحم على قلبي من اغيابك,Positive
احتفلنا اليوم في درنة ولأول مرة باليوم الوطني للزي الشعبي الليبي,Positive
هكذا نغطي على برشلونة ونسلط الضوء على مدريد ونلعب من ورا الستار نسيتو قول سواريز في الليغا اللي اخذتوها,Positive
محبوبتي لا تقبل قسما قد أبدع من ريم الرسما,Positive
علمني هذا الحب ان الدنيا لن تحزنني و انا معك,Positive
اتغار نعم اغار ممن من الذين رأوا الكعبة وطافوا حولها ولمسوا احجارها وانا لها مشتاق,Positive
امي القلب والعشق الاول احبك اخواني الصغار حبايبي مفاجئتكم البسيطه تعني لي كثير احبكم,Positive
أسميتك من جهلي وطنا ونسيت ان الأوطان تحتل,Positive
بادر علي بوصالك ي بهجة المكروب إسعى وانا بسعالك ي غاية المطلوب,Positive
تصبحون على خبر تم إيداع في حسابك دينار كويتي,Positive
ولكم ولوالديكم وكل عزيز لديكم آمين صباح الخير,Positive
لو كل مرة أحتاج لك ألجأ إليك واعانقك ما كنت بخلص من عناقك,Positive
شعورك بالرضا عن نفسك أهم من شعور بأن الكل راضي عنك,Positive
ان اخبرك طفل انه يحبك فأعلم انك امام حب حقيقي صادق الاركان وان اخبرك انه عندما يكبر ويشتري جوال سيتصل بك ويطمئن عليك فليكن ردك عناق طويل,Positive
هو الوحيد الذي يستطيع أن يكون لي الصاحب و الحبيب والحياة في وقت واحد,Positive
طبق الدجاج مغطى بالفستق ومحشي بجبنة الماعز الشهية مع صوص البرتقال,Positive
الحمدلله الذي هدانا لهذا وما كنا لنهتدي لو لا أن هدانا الله,Positive
عشان راحتك أنا راضيه بهذا التعب عشان فرحتك قلبي ينكسر لك حزين,Positive
الله يخليكي يا قلبي كلك ذوق عيونك هي الحلوة دايما,Positive
عش كل لحظة كأنها اخر لحظة فى حياتك عش بالحب ب الإيمان ب الأمل و قدر قيمة الحياة د ابراهيم الفقي,Positive
تعالي نتزوج بسرعه علي حسابك كل شي انا ادخل بمجهودي فقط,Positive
ليت وصلك حرب بالسيف الصقيل كان اجيش له جيوش بلا عدد,Positive
ايام قرب عيد ميلادك ياللي فيك الحياة صارت حلوه,Positive
اوكيه انا اخيرا هانزل الكلية وده شيئ لو تعلمون عظيم جدا,Positive
يبحثوا عن السعادة وأنا موجودة يالله لا تعمينا بس,Positive
الحمدالله الذي حفظ عافيتي وستر خطيئتي ومازال يعطيني الحمدالله دائما وابدا,Positive
صلة عظيمة جدا بينك وبين قلبي اللي يرفض الإنقطاع ويرفض غيرك دائما,Positive
الصعب سيمر والألم مؤكد سيعقبه فرح بأذن الله,Positive
سيكون كل شيء جميل ربما ليس اليوم و لكن بالتأكيد يوما ما,Positive
سامحت لأنني أخجل أن آقف على بآب آلله آطلب آلعفو وآنآ لآ آعفو مسامحه الجميع,Positive
قال بعض الحكماء الصدق عز وإن كان فيه ما تكره والكذب ذل وإن كان فيه ما تحب ومن عرف بالكذب اتهمه الناس في صدقه,Positive
تحديثات الأيام الجاية يارب تمم على خير يارب,Positive
ريما خالد التغريدات صاحبتها متوفية الله يرحمها ياليت تقرأونها,Positive
ما خلقنا الله إلا لهذا اليوم ومثله لا بارك الله في الجبان,Positive
مهما حضنت ناس يبقى فيني شعور داخلي ان قلبي ماراح يدق الا لذاك الحضن,Positive
واحشني اقسم بالله يامخ ياليت الايام تعود بنا يا صاحبي,Positive
لم ابحث يوما عن شيء يفتنني بك لطالما كانت كل اشيائك العاديه تأسرني,Positive
أما بعد فالله لا يخذل إنما يؤجل حلول رحمته لوقت يعلمه ولا تعلمه انت,Positive
لكل واحد ناقص عقل يفكر كذا أقرها لما تتعب عيونك,Positive
على النقا والبياض وصافي النية أعامل الناس صادقها وحاقدها,Positive
امي لست اراكي اجمل ما في الدنيا بل اراكي دنيا كل ما فيها جميل,Positive
وتولني فيمن توليت ولاية أغتني بها وأكتفي لا يضرني ضا ولا يمسني وصب ولا نصب أنت وليي في الدنيا والآخرة بك قوتي وكفايتي وغناي يا الله,Positive
سلواي في الهجر دعاء خافت وجداول من مدمع الرقراق ليت الذي بيني وبينك في يدي فأضمه ضما بغير وثاق,Positive
انت فتاة جميلة ذكيه أنيقه ملهمه بسيطة وهذا يكفي أن تكوني فخورة ومليئه بالحب,Positive
ما كان من الاول نقدر ام النعمة ونحمد ربنا عليها ما كان من الاول,Positive
يقولون انني الاسوء واننا صديق سيئ وحبيب فاشل ومريض نفسي فهل تظل معي,Positive
صح والله احسه احلى اسبوع ف الحياه ببااي باي دراسه سوف نشتاق اليكي,Positive
لكل من يقرأ أتمنى أن يصادفك شيء جميل قريبا يغرق قلبك بالسعادة,Positive
قد تجد وجها كوجهي ولكن القلب لم يخلق منه أربعين,Positive
ربي إن قصرنا في عبادتك فإغفر لنا وإن سهينا عنك بالدنيا ردنا إليك ردا جميلا,Positive
ورغم أنك في أعماق قلبي إلا أن حديثك الجاني هز عرش قلبي,Positive
همسة بين صديق يبحث عنك وقت الفراغ وصديق يتفرغ للبحث عنك تكمن مسافة الألف ميل,Positive
كيف رمضان هالسنه ماحنشوفك بطل مسلسل جديد ي كبير,Positive
ربنا آتنا في الدنيا حسنة وفي الآخرة حسنة وقنا عذاب النار آمين صباح الخير الجميع,Positive
أنتي جزء مني والشي الأبدي في قلبيأنتي بمثابة الناس جميعا,Positive
تحت هذه التغريدة سلسلة من مقتطفات شعر أحمد مطر,Positive
حتى وإن بدت السماء بعيدة إن الذي فوق السماء قريب الحمد لله,Positive
وسيجعل الله من كل هم فرجا ومن كل ضيق مخرجا,Positive
يارب يارب يارب يارب يارب يارب ولن يخيب من نادى ب يارب,Positive
لست أكثر شخص يقابلك ولكني أجزم بأني أحبك اكثر من كل شخص بحياتك,Positive
اربح ايفون مع مخضرم وجهك صباح الخير الله يا وجهك,Positive
لا تدري لعل الله يحدث بعد ذلك أمرا ملخص اليوم انهرده والله,Positive
ما ذهب جميل إلا وجاء أجمل فالحمدلله دائما وأبدا,Positive
رؤية الغائبين في الأحلام هو أشد أنواع اللقاء وجعا للغائبين نقول,Positive
قال سول الله ص من أحب عليا فقد أحبني و من أحبني فقد أحب الله,Positive
كأن يديك المكان الوحيد كأن يديك بلد آه من وطن في جسد درويش,Positive
نهاية القصة محمد عبد الجليل يلعب الان الخرطوم,Positive
وقل للنقاب أنى أحبه وأنه ف قلبى أعلى مقام,Positive
سيلتئم كل شبر كسر فيك ستضحك حتى يعجز الكون عن احتضان بسمتك ستزول عنك العتمة التي طوقت كل حنايا جسدك,Positive
اليوم معزوم عند عائلة مصرية شايل هم وقت الاكل كيف اكل بيدي,Positive
لم يتبقى من الوقت سوى القليل بادري بالتسجيل قبل انتهاء الموعد والرحيل,Positive
صباح الخير لأولئك الذين يستمتعون بالحياة الذين تلمع أعينهم عند سرد قصة الذين يغنون والذين يخبروك دائما بأن الأمور ستبدو على ما يرام,Positive
أحمق ذلك اليائس الذي لا يفهم لماذا يعطيه الله أياما جديدة,Positive
اول مره احس بهذا الكم الهاائل من العصبيه استغفر الله بس عادي انبط في شكل اي حد للأسف,Positive
قد كان الشعور دفعة واحدة أحببتك وكأني احرص على أن يمضي قلبي بك أن لا ينفذ شعوري منك أن أحبك على اكمل وجه,Positive
العالم كله واقف على ريل وحدة بسبب اجازتك ام يومين,Positive
غدا الجمعة هو المكمل ل شهر شعبان والسبت هو اول ايام شهر رمضان المبارك كل عام وانتم بخير اهلا رمضان,Positive
كيف لا يكون ريال مدريد مذهل وفي دكته زين الدين زيدان فهد العتيبي,Positive
الاهلي عام من الانجازات انجازات عظيمة لنادي الاهلي دوري و كاس ملك و ولي عهد,Positive
توقيت الهدف مريح جدا مثل احساسنا اذا الكوره مع ميسي,Positive
من يحتفل بيوم الام احتفلوا بهدوء فهناك يتيم يتالم الله لا يحرمنا من امهاتنا,Positive
يبدو أننا سنقول نهاية الموسم أنها ليغا ميسي الفتى الاعجازي,Positive
ربي اسألك ان تلبي اماني معلقه في قلبي و قلوبهم و ان تكتب لي و لهم الخير حيث تريد,Positive
ما خاب من قال ربي أنت الميسر وأنت المسهل سهل أمري وحقق مطلبي وسخر لي كل ما هو خيرا لي,Positive
أقسم بالله أني بيني و بين نفسي كنت متوقع رونالدو يسجل هاتريك و أحتفظت بهالتوقع لي الحالي ياه يا رونالدو,Positive
اين تجد راحتك من اعرض عن ذكري فأن له معيشة ضنكا,Positive
أسعد الله صباحكم بكل الخير والحب فلسطين أون لاين,Positive
الثلاثاء جمادى الآخرة ه الموافق مارس م يومكم معطر بذكر الرحمن وطاعته,Positive
الحب بكل إختصار ان نضحك ونبكي مع بعض وان اكون انا انت وانت انا,Positive
قلبي لازال يتمناك رغم أني تألمت منك كثيرا,Positive
في مثل هذا اليوم سنة برشلونة حقق دوري ابطال اوروبا امام ارسنال هدف بيليتي تاريخي,Positive
فدعا ربه اني مغلوب فنتصر اني مغلوب فنتصر اني مغلوب فنتصر يارب نصرك وفرجك ياربي,Positive
أصبحنا وأصبح الملك لله آخر فاينل الله يسهله,Positive
بمناسبة اليوم العالمي للمرأءة حافظي على جمالك فهو اغلى ما لديك بعد الآخلاق,Positive
يارب إكفيني شر من يستغفلني و شر من يستغلني وشر من يطعني خلف ظهري و أشغل من أراد بي سوء في نفسه فإني أستودعك حياتي يا من لا تضيع ودائعه,Positive
على الأرائك متكئين زال التعب و تم النعيم فطاب الإتكاء أسأل الله لي و لكم الجنة صباح الخير,Positive
إن قآله الله يعتدل كل مآيل ولابد آلليآلي آلسود يظهر قمرها,Positive
أكثر اثنين يهلكون بعضهم بالفرح وأكثر اثنين فالهوى مغرمين,Positive
مساء يحمل مع نسماته رضا الله مساء جميل كجمال قلوبكم عطر الله مساكم برائحة الجنه,Positive
ربنا لا حال يدوم و لا أناس يبقون فلا غيرك الباقي اغفر لنا و ارحمنا إن قصرنا بحقك إنك أنت الغفور الرحيم,Positive
بكل إستسلام أنا وصلت فيك ل ماأريد دنيا بدونك أريدك لو إنك شر قبل ماتكون لي خيره,Positive
ثق أن الصوت الهادي أقوى من الصراخ و أن التهذيب يهزم الإهانة و أن التواضع يحطم العزور و أن الاحترام يسبق المحبة,Positive
إنني أؤمن عن يقين أن سعادتنا تبدأ داخلنا وأن السعادة في العطاء ربما تفوق السعادة فيما يعطيه لنا الآخرون صباح الخير,Positive
إجعلني يا الله ذات حظ جميل وذات قدر أجملوإجعل أمنياتي قريبة,Positive
لا تشحذ ودا باردا ولا تسأل وصلا متكلفا ولاتنتظر مجىء من لا يجىء تقدم بعقلك وتراجع بقلبك,Positive
هناك من ترتقي بالحوار معهم و هناك من ترتقي بالصمت عنهم كلمه للي يحسدك,Positive
فوق هذا الحب أحبك وبعد أكثر كثير ياللي تدري إن قربك أنا احتاجه كثير,Positive
كتاب عندي من ثالث ثانوي المدهش بالموضوع اني مازال مخي رياضي,Positive
عيد الام كل يوم اشوفها هو يوم عيدي امي امي جعلني فدوة نسمها,Positive
وإن ضاقت بك الأركان يوما فركن الله باقي لا يضيق,Positive
وكأنها رصاصة عالقة في قلبي كلما حاولت أن أستئصلها أبكتني,Positive
صباح ال ياليت كل الكلمات كلماتك وكل الصباحات تبتدي فيك وكل الأيام انت,Positive
ركعتين في آخر الليل قد تغفر ذنبك وتزيل همك وتشرح صدرك وتستجيب دعاؤك وتحقق أمنيتك,Positive
ليش تحطمي احلامي لا تخلوني اصنف فجأة واروح وحدي كما ذيك المرة,Positive
أنت كزهر أبيض يتعمق في قلبي ك عمر يأخذ كل تفاصيل حزني,Positive
السلام عليكم ورحمة الله وبركاته اصبحنا وأصبح الملك لله الواحد القهار,Positive
لا زلت نقطة ضعفي ب كل الاحوال ولا زلت باقي في حياتي حياتي,Positive
الحمدلله الذي حفظ عافيتي وستر خطيئتي وما زال يعطيني الحمدلله دائما و أبدا,Positive
من الرائع أن يكون لديك صديق كلما اتيت إليه متكدرا رجعت منه صافيا و كلما قدمت إليه ضعيفا عدت منه قويا,Positive
مبروك لجماهير الاتحاد وهارد لكم جماهير العالمي قدمتم مباراة جميلة الاتحاد النصر,Positive
سببها كوادر تربوية وتعليمية مدربة وإدارة واعية مدركة حكيمة وبيئة تعليمية مثالية من أجل هذا كان لزاما أن يعم عطاؤها مدنا اخرى,Positive
ل أمي إذا بانت البسمه على وجهك احس إني انا المسرور,Positive
الخير كله في الرضا فإن استطعت فارضى و إن لم تستطع فاصبر,Positive
الاهلي العين بسم الله على بركة الله يارب جملها بفوز اهلاوي,Positive
أشعر بما تشعر به دون أن تتحدثوكأن إحساسنا واحدوكأن مالنا قلبين,Positive
