Feed,Sentiment
إن المرأة داخل البيت ليست خادمة أو عاملةبل هي ريحانة هي وردة البيت عيد الام,Positive
أكرمني بعفوك وجد علي بإحسانك يارب الحرم المكي الشريف,Positive
التقينا في مقهى ارتجله الحب لنا كنا هنا هو والبحر وطاولة صيف مسائية هو وانا وتنهدات الامواج بيننا,Positive
سأفتخر دائما و ابدا انني انتمي لهذا الكيان الهلال الملكي,Positive
لعل الله الذي حرمك الحظ مرات ومرات يخبىء لك حظ يسر العين ويروي الظمأ فصبر جميل,Positive
مسرع وصل الكويت الخفجي كم ساعه عن الكويت ذكريات لا تموت,Positive
الله يسهلها وتروحي وترجعي لي ب سلامة موفقه ي جميلة,Positive
أمي وإني أراك بعين قلبي جنة يا من بك مر الحياة يطيب,Positive
بدلا من التفكير في موعد عطلتك القادمة ربما من الأفضل أن تصنع حياة لا تحتاج الهروب منها سيث غودين,Positive
إني أحب عبدي هذا فأحبوه يا رب هذه المنزلة آمين,Positive
أسعد يا الله كل من مر على دروبنا و ما ضر إن هو باق حتى اللحظة أو قد رحل,Positive
نظرت إليك فكأنما الدنيا بما فيها سكنت عينيك وكأني أنا الهارب من سقم الحياة وملاذي كله بين يديك,Positive
شاركونا في هذا الهاشتاق الجميل الحقيل للطب الرقمي,Positive
هل تعلم ان الارتباط بفتاة مجنونة مفيد للصحة ويطيل في العمر ويؤدي إلى ارتفاع معدلات السعادة في الدم,Positive
هل تعلم ان الفلوس نفس الديتول تقضي على من المشاكل,Positive
الله يبارك فيك وبعمرك ويسعدك ويسعد مساك الجميل والطيب يا طيبة,Positive
برشلونه باريس اعظم ريمونتادا في تاريخ كرة القدم لا مستحيل مع برشلونة,Positive
يارب استودعتك كل دعوه رفعتها إليك ف استجب لي يا رحمن,Positive
الله احن من ان يرى قلبك متعلق بشئ ولا يعطيه لك فلا تيأس فقط اصبر,Positive
وأي صباح هذا ما لم يكن فيه خيرك وأي نور هذا ما لم تشرق فيه شمسك,Positive
انا مستسلم حبيبي من إلى وما أبيني إلا لك وتكون ليا,Positive
مشهد من مغادرة محترف الاتحاد محمود كهربا مع الفريق للقاء الاتفاق غدا في الدوري,Positive
الله أرحم من أن يضع أمامك كل هذه الحواجز بلا أن يزرع بك القدرة على تجاوزها,Positive
يا ابن آدم لو بلغت ذنوبك عنان السماء ثم إستغفرتني لغفرت لك أستغفر الله الذي لا إله الا هو الحي القيوم وأتوب إليه,Positive
تعال يا وجه السعد و اشطب على الوجه البغيض,Positive
انتقل إلى رحمة الله محسن الموسوي إنا لله وإنا اليه راجعون,Positive
كل لحظة تمر بها وتراها صعبه عليك أن ترسم الابتسامة على محياك و تدرك إنها ذكرى جميلة ستتذكرها لاحقا,Positive
سبح لله مئة مرة يغفر الله ذنوبك حتى وإن كانت مثل زبد البحر,Positive
ربي إنهم كانوا يفرحون بسماع صوت المطر فأمطر على قبورهم من سحائب رحمتك وغفرانك وافتح لهم بابا تهب منه نسائم الجنة,Positive
وانت اغلى من نظر عيني لا تعاند وارجع استغفر,Positive
أبيك من قبل لا اتعلق بك وأشوفك لي شريك وأبيك من قبل لا تتجمع لك أحبك وأعترف,Positive
بسمك ربي وضعت جنبي وبك ارفعه فأن امسكت نفسي فارحمها وأن ارسلتها ف حفظها بما تحفظ بها عبادك الصالحين,Positive
كلمه ضروري تقولها وجهك مهم و مخك اهم فياليت تكونون جميلين العقل والكلام و الهندام,Positive
سامحني يا الله إذا بكيت على من رحل وأنا أعلم أن برحيله خيرا سامحني يا الله إذا آنفلت صبري وضاقت نفسي,Positive
يارب استجب دعوتي عاجل غير اجل مع ذا المطر,Positive
ماكنت اقسى شي بالعكس كنت أجمل حزن ممكن يمر ب حياتي,Positive
شكلي فعليا باخذها علشان اضحك كل تغريدة عنها طقطقة,Positive
من أي عمق يأتي بريق اللقاء في الأعين حين ألقاك,Positive
حبي فداك الكون قلبي وهدب العيون فيك العقل مجنون,Positive
هالايام صرت اول ماقوم من الشبريه افكر متى ارد ارقد,Positive
ستتغير نظرتك للأماني التي كنت تظنها مستحيلة الوقوع عندما تؤمن بهذه الآية قال كذلك الله يفعل مايشاء,Positive
يارب ايقظني على خبر يسعدني ويسعد قلبي ربي بشرني خيرا بما انتظره وانت خير المبشرين,Positive
بالتوفيق ان شاءالله حلو الصيفي بالذات يوم درجة الحرارة و رمضان,Positive
هام قلبي في هوى ربة الوجه الجميل جادل في كل وقت يليق بها الغزل,Positive
حبك كبير اكبر من احساس الخيال ب خاطري اكبر من اني انكره واكبر من اني اذكره,Positive
شباب المستقبل الفي الهاشتاق دا بيتعاطو شنو ماذا حدث لشخصيات سبيستون,Positive
أستغفر الله عدد ما كان وعدد ما يكون وعدد الحركات والسكون,Positive
هناك أشياء وأشخاص وكلمات واختيارات وأغذية وألوان ولحظات وأمكنة تشعر أن فيها إمتداد روحك كن منتبها لذلك فإنها حقيقة إتساع الروح,Positive
مرة ذهبت لروسيا والتقيت شارابوفا واقنعتها بان تسلم وتزوجتها و بينما كنا نلعب تنس اصابتني كرة في رأسي ففتحت عيني فوجدتني سقطت من سرير النوم,Positive
أكبر طموحاتي أعيش ب سلام لا حد يأذيني ولا اضايق أحد مساء الخير,Positive
سعادة الآخرين لن تقلل من سعادتك وغناهم لن ينقص من رزقك وصحتهم لن تسلب منك عافيتك كن نقيا وتمنى لغيرك ما تتمناه لنفسك صباح الخير,Positive
من قال سبحان الله وبحمده في يوم مئة مرة حطت خطاياه وإن كانت مثل زبد البحر,Positive
للصباح روعة تكمن في التواصل مع أرواح نقية صافية بريئة,Positive
الساعه البيلوجيه ضاربه عندي كيف اضبطها اكثر اسباب الزعل,Positive
سيبصق عاليا في محاولة الوصول إلي ثم سترتد على وجهه,Positive
تعجبيني في غرورك واعتزازك وتتعبيني في ميولك وانحيازك,Positive
ما من شخص يرى نعمة الله عليه فيقول الحمدلله الذي بنعمته تتم الصالحات إلا أغناه الله وزاده,Positive
وما حيلة المشتاق لما تزوره ملامح من يهوى وتبقيه معدما,Positive
الحمدالله بعد صراع طويل مع النوم نمت و قمت بعد اربع ساعات,Positive
عطاني الله شخص يستحق أني اقوله محيت الكل من قلبي كأنك أول أحبابي,Positive
اذا أردت أن تفعل خيرا ولا تملك المال ابتسم في وجه أخيك فإنها صدقة,Positive
في مثل هذا اليوم بعد كم شهر بنكون جالسين نشوف جيم اوف ثرونز,Positive
أنا لم أكن أدري أن بداية حياتي لديك وأن نهايتها إليك وأن لقيانا قدر,Positive
نهائيات لليغا يجب ان نكون في فورمة عالية بالامس كنا نتعثر امام اسبانيول بالكاد فزنا القادم افضل بإذن الله,Positive
أيها الفرح اوصيك خيرا ب مدريد ريال مدريد بايرن ميونخ,Positive
أنا على إستعداد أن أفلت يد العالم مقابل يدك,Positive
صباحي عيونك النايمة صباحي انتي يا أجمل صباحات ربي,Positive
اذا هدى ماستر بيولوجيا تخصص بيو تكنولوجي جامعة ورقلة يا ترى كم يوجد من هدى بهذه الصفات,Positive
لما اثنين غريبين كل ما يشوفوا بعض يبتسموا وبعدين يصيروا أصدقاء هذا أنا وصفاء,Positive
لننهض فى تفاؤل وننتظر صباحا جميلا يطل علينا فتشرق فينا الشموس ويستيقظ فينا الأمل صباحكم تفاؤل صباحكم من الجنة أيها الاحبة,Positive
الله لا يشغلنا الا بطاعته المصيبه تقول اترزق الله,Positive
ماذا قدم مكتب دعوة حلي منذ بداية هذا العام نصف عام من الإنجاز ومعا لخدمة هذا الدين,Positive
ممتنة للجمآل للورد للكلمة اللذيذة ممتنة لكل مآيمنحني إمكآنية العيش أكثر من الحيآة صبآح متفآئل,Positive
لقد إستلزم الأمر الكثير من الحب لأكرهه بالطريقه التي أشعر بها توم هاردي من فيلم,Positive
همسة صباحية كل مواجع الحياة تمحوها آية وعسى أن تكرهوا شيئا وهو خير لكم صباحكم خالي من الهموم,Positive
وكأنه حلم مر بحلوه ومره فستبقى الذكر ونكمل ما تبقى الحمد لله,Positive
توقعات كاتب أمريكي لرؤية المملكة نتفاءل خيرا رغم انني اخشى لن يتحقق ذلك بالشكل المطلوب والمذكور أعلاه,Positive
ليست عقلانية المغردة و إنما عقلانية الحياة و للحياة صفات عديدة,Positive
الآ عيونك طآلبك لآ تحزنها قد قلت لك هي أجممل اشيائي,Positive
علمتني الحياه اذا أردت الشيء يدوم لا تتحدث عنه,Positive
الصراحة يرتاح بالي ان شفت الي احبهم مرتاحين وسعيدين,Positive
عذابه من أين أتيتم بهذا اللفظ تداركوا أخطائكم فأنتم صحيفة واسعة الانتشار,Positive
صلاة الفجر أول مفاتيح الخير ليوم كله طمأنينة وراحة بال وحفظ من كل مكروه كيف لا وأنت في ذمة الله حتى تمسي,Positive
الرطوبه في الطبقة البنائية ال الآن اخدود السعاده,Positive
اتأملك كأنك لوحة فريدة من نوعها لوحة تستوقف المارة رغم الزحام,Positive
قد تنام علي أمر يئست منه و تستيقظ علي إنفراجه فقط ثق بربك,Positive
إن غبت لم ألق إنسانا يؤانسني و إن حضرت فكل الناس قد حضرو,Positive
كل شيء سيكون بخير في نهاية وإن لم يحدث ذلك فهي ليست النهاية,Positive
محمود اوغاريت سلايم آسر محمد ما يحتاج معرفاتهم هم يعرفوا نفسهم,Positive
ومن آداب الحديث ألا تقاطع عينيها وهي تتكلم,Positive
فلعل الله يغير من أجلك كل شىء ليرضيك ويرضي قلبك,Positive
البعض يريد منك ولا يريدك أنت البعض يريدك ولا يريد منك وهناك أشخاص يحادثونك وقت فراغهم وهناك أشخاص يتفرغون من أجل محادثتك هنا الفرق,Positive
ليتك تحس بثلاث حبي لك غيرتي عليك وكرهي ل وقتي بدونك,Positive
بأمان الله يا شهداء كفريا والفوعة بأمان الله,Positive
يا رب قدرني أكثر على الكتمان عودني على نفسي و لا تعودني على أحد,Positive
شكرا لكم على عطائكم الدائم والتميز على كل المستويات فعلا أنتم ناجحون,Positive
أعشق كل لحظة معه في يومي ابتداءا من صحياني الى وقت منامي,Positive
السعادة لا تأتي من فراغ ولا تولد من العدم هناك قيمة ايمانية عميقة هي الاكتفاء بما كتبه الله لك,Positive
انت الملاذ لغربتي لا من شعرت إني وحيد وانت البلاد الآمنة إلى من اتوه ألجا لها,Positive
كل العقبات التي كنت تجزم على أنها أصعب من أن تتجاوزها هي اليوم خلفك لتتأكد أن الله لا يكلف نفسا إلا وسعها صبااح الأمل,Positive
يا من توهم أنى لست أذكره والله يعلم أنى لست أنساه إن غاب عنى فالروح مسكنه من يسكن الروح كيف القلب ينساه,Positive
وهنا اقف ولاأقفو كل أمرقد يسوغ أويختلف مع مذاق المتلقي فقد تتسنى لي العودة يوما ما أولا وبهذا علي أن أعترف وقفه,Positive
أن روحوا فأنا بري منهم ليوم الحساب وإن جرحوا قولوا لهم ماحركوا في إشعره,Positive
ان حصل واختلفنا او في يوم افترقنا شوقي يعنيني وانت يجيبك اصلك وطيبك,Positive
في ظلمة الليل وفي حالة الهدوء إختم يومك بصلاة الوتر فإنها سكينة للقلب وطهارة للجسد ودعاء مستجاب باذن الله,Positive
تضحك بشكل حيل حلو لدرجة بكل مره يزيد حبي لضحكتها,Positive
أن تقع عيناك على عيني من تحب لدقيقة أفضل من محادثه خلف الشاشات لسنه كامله,Positive
عندما تظلم الطرق في مدريد وتقفل المفاتيح وتضيق السبل يأتي راموس لينقذ مدريد كلها شككرا للقآئد سيرجيو راموس,Positive
حلمت بوجهك البآرح ومن البآرح احاول كيف آعيد الحلم,Positive
وغدا ستغمرك البشائر مثلما غمرت بشائر ربنا أيوبا,Positive
حتى سميك يوم أقارنه وياك آآقول يحمد ربه إنه سميك,Positive
أكثر وحدة في الدنيا تصور و تتأمل صورها انا,Positive
عندما تراني مندهش باهتمامك لادق التفاصيل التي تخصني فاعلم ان هذه الصدمه هي صدمه اعجاب عشق غرام حب,Positive
أنت الذي مايشبهك بالملا حي ما ألوم من سماك سيد العذارى,Positive
والله العظيم احلى فرحة فرحتها في حياتي برشلونة,Positive
لربما ربك أزال منك شيئا تحبه ليريك ماهو خيرا لك واجمل,Positive
من حبي لها نحضن لها شكرا على الصورة الحلوه,Positive
كل أصدقائي لاحظوا البهجة التي خلقت في وجهي,Positive
همسة صباحية لا شيء يخترق القلوب كلطف العبارة وبذل الإبتسامة ولين الكلام وسلامة القصد وغض الطرف عن الزلات صباح الابتسامه,Positive
أحيانا أصمت لأن أجوبتي تقتلني قبل أن تقتلهم فصمتي يعني في دآخلي حروف لو نطقت بها لآهتزت أبدانهم وجعا,Positive
يالله هنالك قلوبا أخاف عليها كما لو كانت قلبي يالله لا تذقني حزنها ولا تعبها إجعلها قلوبا سعيدة في الدنيا وفي الآخرة,Positive
يارب إن ألهمتني فكرة فألهمني معها القدرة على تحقيقها وإن وهبتني حلما فهب لي معه اليقين فيكون واقعا,Positive
لو أستطعت إعادة أول لقاء جمعني بالبعض لأبتسمت لهم فقط و أكملت طريقى,Positive
ورشة في الإسعافات الأولية السبت م الدعوة عامة للجميع,Positive
تغمضين عيناك حين تبتسمين لأنهما معا كارثة لا يقوى الكوكب على إستيعابها فهل تعملين,Positive
مع شروق شمس يوم جديد يا رب طهر قلبي من كل ضيق ويسر لي أمري في كل طريق صباح الخير,Positive
محاولتك في التخلص من كونك سيئا أكبر دليل على صلاحك مسا الخير ياعرب,Positive
تغريدة حب للرياضة و بوط الرياضة و بنطلون الرياضة و مدرب الرياضة,Positive
تم حصولي على افضل مدرب في بطولة كاس الوزارات الوعد الموسم القادم,Positive
كل مايجيء الفجر كأن صوت الآذان يبحث عن عتمتي لينيرها صلاة الفجر,Positive
لا عذب الله أمي إنها شربت حب الوصي و غذتنيه باللبن و كان لي والد يهوى أبا حسن فصرت من ذي و ذا أهوى أبا حسن,Positive
مايضيق القلب وأنت في الوجود كيف أذوق الحزن وأنت فرحته,Positive
أنت إلي أبتدي فيك صباحي مابين أحبك و أستودعتك الله,Positive
يقول في صوتها بحة حنين سمرا ومبسمها خمر وعيونها لله العجب,Positive
حبيبي يا محمد وانت طيب يا نجم وان شاءالله تعدي جيشك علي خير,Positive
لم نولد على هذه الأرض لنكن سعداء طيلة الوقتفقط أؤمن بداخلك بأن هناك منعطفات إن صبرت عليها نلت الرضا والسعادة,Positive
احتفظ ب أولئك الذين لا يكترثون ب ترتيب أحاديثهم معك الذين يفرضون عليك نقاءهم دون تكلف و يخبئون لك حب يتشكل على هيئة دعاء,Positive
اهلنن مسائكم غبار لا لا امزح مسائككم وجهي الجميلل,Positive
عندمآ تتعلق بأحد كن دائما مستعدا لغياب راقت لي,Positive
اذا غبت الجميع يغيب وترد الروح بقدومك ساعتين احلام,Positive
رب احفظ لي قلبا احببته و ابعد عنه كل ما يحزنه و يؤذيه,Positive
ولا تكونوا كالذين نسوا الله ف أنساهم انفسهم استغفر الله العظيم واتوب اليه سبحان الله وبحمده سبحان الله العظيم,Positive
نوتيلا مع كلمتين حلويين كيف تمتص غضب المراه,Positive
رحم الله ضحكة لا تنسى وملامح لا تغيب عن البال رحم الله كل روح غالية تحت الثراء,Positive
السلام عليكم ورحمة الله اول تغريدة من تونس الخضراء,Positive
صلواعلى من تدخلون بشفاعته دار السلام صباح الخير,Positive
نصيحة تذكرها دائما قدس نفسك ولا ترضى بأن تكون مع من لا يعرف قيمتك ولا تترجى شخص ليدوم لك فمن يحبك يعلم جيدا كيف يعاملك,Positive
ويجلس أمامي يغرق بالحديث اسند وجهي بكفي وأغرق بعينيه,Positive
قال النبي الكلمة الطيبة صدقة قل خيرا وأكثر فبعضهم يستمد سعادته من كلماتك وبعضهم يصنع منها حدائق تفاؤل وبساتين فرح,Positive
عروض اخر الاسبوع من جلامور بيوتي ولمدة يومين فقط شحن مجاني على كل شيء حتى المخفض استغلي الفرصة انقري على الرابط,Positive
يختلف الصباح عن أي وقت الصباح نشاطأمل تفاؤل طموح الصباح هو الوقت الأمثل لتجد نفسك سناب صباحي,Positive
أمشي معه من غير لا أين ولا كيف و ليه من حيث مايجرفني اغمض عيني وانجرف,Positive
ف عز الخصام قال أسمعك صوتي ويلين قلبك الزعلان,Positive
سيقر الله عينك بما كنت تدعوه ويحقق لك ما كنت تصبر لأجله,Positive
حزنك لايعلم به إلا الله ولايهونه عليك غيره مهما كثرت وجوه الأحباب من حولك هناك داء رهيب يجول بداخلك ولن تلقى دوائك إلا عند الله,Positive
ربي اكتب لنا صباح يوم جميل تسعدنا بتفاصيله واغمرنا بخيرك الذي لا يفنى,Positive
تغريدات جماهير النصر بداية الموسم وهم يتوعدون الهلال اقرأ واضحك,Positive
الفرق المتاهلة الي نصف نهائي ابطال اوروبا ريال مدريد يوفنتوس موناكو أتلتيكو مدريد ليلة الأبطال,Positive
انت شمس بكبريائك و بهدوئك و أنا كوكب استمد نوري بضوئك عبدالعزيز الويس,Positive
مرحبا بك قد تكون نفذت الكمية لكثرة الطلب عليه ولكن لدينا المزيد من الاطباق الجانبية المميزة بانتظار تجربتك,Positive
قد نشتري كل شيء في الحياة إلا القلوب الصافية فإنها تمنح نفسها هدية صباح التسامح والقلوب الصافيه,Positive
صوت عبدالمجيد عبدالله يفوز في تحسين مزاجي دائما وابدا,Positive
اصبحنا واصبح الحب والملك لله صباح السبت السعيد والمبسم الجميل والوجه الطليق,Positive
لماذا تحبها لأنها تملك شيئا لا تستطيع مستحضرات التجميل إضافته هلوسات مسائية,Positive
مانشستر يونايتد تشيلسي هذا الأسمراني في طريقه ليكتب اسمه بحروف من ذهب,Positive
تبقى بقلبي رغم بعد المسافة وأبقى أحبك لو قل الكلام,Positive
اآوجاعك التي لم يلتفت لها اآحد هي تحت عناية الله,Positive
ستبقى مجيدا وفخرا وعيدا وصرحا فريدا يطال السماء,Positive
يارب مع بداية صباح جديد كن عونا لكل الذين اتعبهم المرض واصبح الانين رفيقهم يارب بحولك وقوتك اشفهم شفاء لايغادر سقما,Positive
اهم شيء ادفع لنا نص مليون وامسك الباب حياتك,Positive
تقبل الله منا ومنكم صالح الأعمال في يوم الجمعة أكثروا من الصلاة على حبيبنا محمد,Positive
يجب ان تكون العلاقه بين اثنين ملاذا امنا و ليس ساحة معارك فالعالم فيه من القساوة ما يكفي,Positive
هل تريد السعادة والشعور بالراحة فقط ركز على هذا الهدف وسيتحقق ابدأ وابتسم ثم ابتسم,Positive
اتشرف فيك ابراهيم انت زميل وصديق صاحب قلب أبيض إلا أنك شقي صحفيا كما لقبتك في أول سطر من الإهداء,Positive
سأكون بجنبك دائما حتى وإن اختلفنا قليلا فلن اتركك لتقاهات الحياة حبي لك أكبر من ذلك ثق بي,Positive
رسالة الصباح ابدأي عزيزتي صباحك باحتساء كوب من القهوة فهذا يعطيكي طاقة كافية لإكمال يومك بسلام,Positive
ولو كنت رجل لا تختبئ تحت اسم مستعار والمغاتير انا لا اتحدث معهم,Positive
احيانا اضطر بالتظاهر بالغباء كي لا افسد عليك متعتك بظنك انك تخدعني,Positive
الي زمان عن عالم تويتر كيف في لايكات وبوستات جداد عندي,Positive
الأصدقاء الأوفياء هم أولئك الذين يقفون أمامك حين تبكي ل يحجبوا عن البشر رؤيتك منكسرا لهم كل الحب والود والاحترام هم في قلوبنا,Positive
ما اسهل الذكر وم آعظم الآجر أستغفر الله العظيم وأتوب إليه صباح الخير,Positive
انا مظلوم نوميا ونفسيا وفلوسيا وحنانيا وحظيا وكلشيا,Positive
جميل هو شعوري بالجلوس جانبك كم جميل مجالستك,Positive
ما زلت تسألني عن عيد ميلادي سجل لديك إذن ما كنت تجهله تاريخ حبك لي تاريخ ميلادي,Positive
اذا إتبعت نظام غذائي صحي فستموت بصحة جيدة,Positive
