Feed,Sentiment
نظرتك للحب من طرف واحد يعتبر إذلال لانك تحبه ويحب غيرك تهتم فيه وله ويهتم بغيرك تحاول تسعده وهو يسعد غيرك,Negative
حظك وحش يا شيكا و الله,Negative
روحي لك الفدا عزيزي آية الله قاسم,Negative
في خاطري أسألك حاجتين لو عكسنا الدور ترضيك أفعالك ء,Negative
سنعتاد ثم ننسى ثم نصبح بخير فلا دآعي للمبالغه,Negative
أسر عليك عتبا ليس يبقى وأضمر فيك غيظا لا يبيت وما ردي على الواشين إلا رضيت بجور مالكتي رضيت,Negative
قال عبدالمجيد مانقصني شيء غير أني اشوفك ودون شوفك ناقصه أشيا كثيره,Negative
يارب بركة بالوقت و الحفظ,Negative
يوم من الأيام سأذهب إلى اليابان,Negative
لاا تواسي احد لانن بينقلب ضدك,Negative
لتنشق الارض و ادخل فيها,Negative
حركة النقل الخارجي من سنوات وهذي السنة ارقامي زادت كيف,Negative
كل الاشياء تجيد الرحيل الا الحنين,Negative
أحتاج معجزة ترضي خاطري من كل النواحي,Negative
ضحكة شفاهك تبري القلب العليل,Negative
كرامتك اكبر من انك تفضل مع شخص بيعاملك علي حسب مزاجه,Negative
في تسعين مليون بني آدم مصري غير السوريين في الشارع,Negative
اكتئاب يوم الأحد و التوقيت الصيفي و الفشل في إعادة الرسم,Negative
في مثل هذا الطقس البارد قام توم بطرد جيري خارج المنزل,Negative
لا تفرحي حتى ترين رئيس جديد مع الفريق ربما مثل مسلسل الماضي,Negative
قصتها شبيهة بقصتي جدا,Negative
يانفس إن لم تظفري لا تجزعي وإلى موائد جود مولاك اهرعي وإذا تأخر مطلب فلربما في ذلك التأخير كل المطمع,Negative
كنا نحب بعضنا البعض فيما مضي,Negative
اكتر ناس بنقدر ننساهم بسهولة هم اكتر ناس بهدلونا نفسيا,Negative
أعوذ بالله من شعور النفس الحزينة وخيبة القلب المخبأة وصمت الأحاديث والعتب الظاهر في العين وعجز الفعل واصطناع الحال بغير ماهو عليه,Negative
أشلاء عشق من حنجرة الذاكرة,Negative
كلموني أبدا كي تخفوا الألما و استجيبوا للدعا إلى,Negative
كيف تجعل ابواب الجنه تفتح لك استشهاد ضابط سعودي باليمن,Negative
عندما أعفو يعني أن قلبي أسود قد يكون الخطأ فاق المقدرة أليس العفو مقرونا بالمقدرة,Negative
كان تتويجهم اليوم علينا,Negative
صباح الخير ياصباح ن صبح القلب مع هذا الصباح,Negative
اصلح شاشة التلفون او ايفون جديد,Negative
يالله في هذا الوقت وكل وقت,Negative
وضعي طبيعي أعامل البندول معاملة البنك,Negative
يارب سلم أهلي من أذى الدنيا وحزن الأيام,Negative
الخوف بجد انك تخسر الانسان الوحيد الا كان حلمك تكون معته,Negative
تعبت من الحلوين قسم بالله تعبت,Negative
كيف اخطأت ورحل زوران بقناعاته حاولت اعديها وعيت تعدي,Negative
اشتاق لك في غيابك و ابقى احبك لو ديارك بعيده ليتك تدري عن حالي في غيابك,Negative
احد يجيب لي كتاب غفران يا جماعه,Negative
جعلك الله يا أبي قرير العين في مرقدك يا نورا لعين من بعدك انعمت,Negative
اكثر الأشياء وجعا هو اجبار ملامح الوجه ع رسم معالم اخرى تعاكس إحساسك تماما الحمدلله,Negative
الحكم لديكم لا خوف عليكم,Negative
هذه لك ي المعجب الخفي,Negative
ما أوجع الخيانة اذا كانت من أهل الدار وثقنا فيهم دهاليز الظلام,Negative
قالت له زوجته ماذا أعني لك قال أنتي كنز فقالت أثبت لي ذلك دفنها,Negative
اعزف يا سيرجي فقد أبكى لحنك صديقك قبل عدوك,Negative
لقطة من الشتاء الجميل اكثر شي بشتاقله جدر السعادة اتمنى لكم صيف مميز جدا,Negative
سؤال للجميع لماذا نحن الرجال اذا احببنا المرأه تموت جميع النساء بآعيننا,Negative
بالفعل الإنسان يشيخ والنهاية تقترب وتصبح كل لحظة أثمن,Negative
اخر تويته عشان اقفله لاجل غير مسمى,Negative
والنفس تبكي علي الدنيا وقد علمت ان السلامه فيها ترك ما فيها,Negative
اخر كلمه للاجازه احبها الاجازة راحت,Negative
كيف ضاعت الهلال النصر,Negative
اي واحد يشبه سنان ونفس عيونه وابتسامته يتواصل معي انا بديت اتعب,Negative
تعبت من الاصوات الحلوة,Negative
بكره حديث واستاذه جديده الله يستر كيف اختبارها,Negative
يارب أيام جميلة ف حياتي,Negative
انام متأخر اقوم الصبح انام من وقت اقوم الصبح يالله صباح الخير,Negative
حينما يشعر قلبك بضيق أيقظه سريعا بقول الحق أليس الله بكاف عبده,Negative
ولا تدري كم صرف الله عنك من ا ذى وأنت كا حمق ما زلت تبكي,Negative
ذاك الفقد الذي كل يوم يزداد حدة بقلبي فلا يبرى الجرح أبدا,Negative
بشار الاسد حيوان يكرم الحيوان لا تظلم الحيوان وتشبهه ببشار القذر,Negative
أنا معد عندي كلام أقوله أنتم عندكم اكتبوا بدالي تعبت أنا,Negative
جرحك الأولي ما طاب كيف يهون عليك تجرحني مره ثانية,Negative
لأني أتذكر وعدي لك حتى بعد الغياب باقي أحبك فكيف لي أن أنساك وأنا أحبك,Negative
ابتسم لحياتك وابتسم لكل ماهو حولك وفكر في كل مايسعدك فالحياة أمل,Negative
يارب ارح كل شعور مرهق اشعر به كل الم كل لحظة فقد يا الله,Negative
لقطه محزنه ان شاءلله اليوم الانتقام بوفون يوفنتوس برشلونه,Negative
السفر وحيدا هروب من الانتظار,Negative
لكل من يعاني من آلام الظهر إليك هذه النصائح لتفادي الإصابة بمضاعفات لا تنسى تسجل الإعجاب,Negative
اذا امتحان الكيميا خايس مثل ما يقولون كيف الاحيا,Negative
لما يدزون لك واتساب كوب قهوتهم و تقارنه بكوب قهوتك,Negative
حاولت أن أفعل كل شيء ليعرف كم أنا أحبهه لكنه لا يفهمني,Negative
فقيدي سلاما على عينيك النائمة طويلا وجسدك النائم تحت التراب بابا,Negative
أكرهك بقدر كرهي لكلاس الساعة,Negative
يا حياة الشقى اربطي الحزام,Negative
اكثر شي يقهر انك ترسل شي لشخص تحبه ويرد عليك ببرود,Negative
جدي و حبيبي ذات يوم غفيت على أمل شفاؤك و استيقظت على خبر رحيلك رحمك الله بقدر شوقي لك,Negative
تحمل يا قلبي مسلسل ولا اروع,Negative
علي طاري السعاده تغريدتك اكبر مثال,Negative
كيم طول الامتحان افكر في الوقت الا ضاع وانا ادرس فيه للزق,Negative
هذا ساحر كيف كذا حياتك,Negative
جربت احساس انك أول ما تتعلق بحد يخرج من حياتك للأبد,Negative
ألا ينتابك هذا الشعور أحيانا أى شعور الرغبة في ألا توجد,Negative
يوم الام احتفلو بأمهاتكم بدون ان تأذو الأيتام,Negative
آخر مرة سيشهد البريدج على ارتداء جي تي شارة قيادة تشيلسي,Negative
وإذ قال إبراهيم رب أرني كيف تحيي الموتى قال أولم تؤمن قال بلى ولكن ليطمئن قلبي صدق الله العظيم مولاى,Negative
عشت حلما أنساني الواقع فتركته لكم,Negative
كم هو مؤلم أن ترى شخصا تحبه لا تستطيع الاقتراب منه فقط تنظر إليه نظرة انكسار لأنه لم يعد ملكك,Negative
الإصرار على النجاح رغم المعوقات العديدة هو نجاح في حد ذاته,Negative
حكم برازيلي يتعرض لإصابة قوية,Negative
أسال نفسك كم واحد او واحدة نقذتهم فى عمرك كله كم هل نقذت ذات يوما يتيم أرملة تربى ايتام رجل عاجز عن العمل جائع مطلقة معيلة مسكين,Negative
ما بين يرجع لي وما يرجع الإنتظار أقسى من الفرقى,Negative
لا تهتم كثيرا ولا تعاتب احد ولا تركض خلف احد لتذكره بوجودك واعرف جيدا ان من يريدك لا ينسى ولا يتغير,Negative
الوجع أصم و الحنين اخرس و الشوق لا يرى و أصدق ما نشعر به أصعب من أن يروى,Negative
دموعنا ليست رخيصة ولكن انهكنا الحنين,Negative
استغربت من عدم احتفالية مورينهو بالهدف,Negative
احتفلوا بيوم الأم بهدؤ ف هناك أمهات تتألم لفقد أبنائهم وهناك أيتام تتألم لفقد أمهاتهم يوم الام,Negative
اتمنى للريال الليغا لاجل زيدان وموراتا لكن ادعوا واتمنى خسارتهم في كارديف وفك العقده لليوفي وبوفون,Negative
كن لطيفا بحديثك فالبعض يعاني من وجع الحياة وانت لا تعلم,Negative
ينبغي للإنسان أن يراعي قلوب الناس فإذا انكسر قلب شخص فليحرص على جبره بما استطاع لأن في هذا فضلا عظيما,Negative
اصعب ما في الشوق انه يكون لأحد ميت,Negative
مادري انا اتحطم من التقويم ولا الغمازه,Negative
لاعب العربي حسين الموسوي يغادر ملعب المباراة بعد ابلاغه بخبر وفاة والده رحمة الله حيث كان من المفترض ان يكون لاعبا اساسي بمباراة اليوم,Negative
حكمه اعجبتني الأنثى كالزجاجة فإن الزجاجة لا تجرح إلا إذا كانت مكسورة فلا تكسرها,Negative
نظرتك للحب من طرف واحد لآ يوجد في الحياة عقاب أشد من أن تحب شخصا ليس من حقك أن تحبه,Negative
ابحث عن قلب لا يحتوي الحزن ولا ينشغل به,Negative
كنت اعتقد وانا صغير اعترفلك ان اجمل ماحدث لي كان انت واسوء ماحدث لي كان رحيلك,Negative
محاولة إعادة العلاقات فكرة سيئة إتركوها تموت لو فيها خير ما إنتهت,Negative
ارفق علي بالله لا تنوي الهجر,Negative
المشكله ليست حديثه عهد مجرد ماتسمع رعد تعرف ان الكهرباء بتطفى انقطاع الكهربا في محايل,Negative
طال السفر والمنتظر مل صبره,Negative
ليت الراحلين يستوعبون أن قلوب احبآبهم ليست من ضمن امتعتهم,Negative
ضاع الضفدع في الضباب تعرفي والله ياريتني ماسافرت,Negative
حياتك اهداء للي يقولون حياتك اطلق من زد رصيدك,Negative
سنرحل كما رحلوا لكن وجع رحيلهم أخذ منا روح الحياة قبل أن نرحل فيارب أجمعنا بهم في جنتك,Negative
يا رب الفرج العاجل من عندك وظيفة مناسبة تعدل مساري و حياتي,Negative
يؤخرها الله عليك ولكن لاينسى قلب ارهقه الأنتظار,Negative
من النهايات التي لن انساها ناروتو احزن موته بالنسبه ليه كانت جيرايا مات على يد طلابه,Negative
ثق تماما بأني لن اتصنع لأعجبك,Negative
حينما يكون الألم هو أفضل مانعرفه يكون التخلى عنه محنة ميشيلا مارزانو,Negative
اربع امتحانات فيومين خافوا الله حسبي الله عليكم,Negative
ثم ماذا ثم إني عندما أراه أتوه رغم ثباتي,Negative
إخواننا الأسرى من بورما في كرب عظيم هل من مجيب,Negative
ايتها النفس المطمئنة ارجعي الى ربك راضية مرضية فادخلي في عبادي وادخلي جنتي,Negative
قاسية القلب داخلها نزيف المنصورة,Negative
ثم تميل رغما عنك وأنت الذي عاهدت نفسك على الإتزان مهما جرى,Negative
لن يحبونك مهما فعلت لهم,Negative
ويسألوني بمن تعاتب في كتاباتك فأجيبهم ذاك الذي أنشدني بالوفاء وأوعدني ب البقاء وتركني مساء الخير,Negative
مزلت بين الأوراق صامدون الي حين اخر,Negative
مجرد وفاة من نحبهم يشعرنا بتفاهة هذه الدنيا,Negative
تؤتؤ ابعد يا شيطان ابعد,Negative
فعليا أحتاج دورة تعريف باللعاب,Negative
وتأتي العوارض من حيث لا تحتسب,Negative
حياتك ياربي عبدالله يقول ل ابوه انتبه لمحمد,Negative
لم انام بالغلط واقعد الحين وبرد انامم امبيه صايره انام وايد لماذا اشبيليتنا,Negative
مع ارتفاع نسبة الجهل والفقر وللاسف عن عمد يصبح هذا هو السيناريو الأقرب للحدوث,Negative
يارب إني تعبت وانا احاول احفظ يارب يستوعب عقلي,Negative
ثباته عظيم يالله انت تعلم كيف حاله يارب فرج قريب,Negative
ايقظني من نومي فجرا وقل انك اشتقت,Negative
هذا الجيل انتصر على الحكام والاعلام وعلى الحظ وعلى السنين العجاف مبروك لكم ومحظوظين برونالدو,Negative
عار على العرب أن تباع الكتب لحاجة لفقر لحصار أمة تقرأ أمة الحضارة والعلم والأدب إلى أين المسير مكتبة قيس,Negative
الأحد الذي لا يحبه أحد,Negative
أموت وجعآ هذه الفترة تغيرت بكل شيء أختلق لنفسي ضحكة مزيفة يظنونها فرح لست هكذا أبدآ متعبة من الداخل بحجم كل شيء,Negative
حملت نفسي أكثر من طاقتي,Negative
الفرحان لما صرت اشجعه صار يدخل برايم حياتك,Negative
الواتس الان صراع على جبهتين شخص واحد ضد قروبين وكل قروب موضوع مختلف,Negative
اكتشفت انني فاشله في اقناع ماما عن بعد مع انه مفروض يكون اسهل ولكن ال لا يبقى لا,Negative
من المؤلم أن تكبر وتكبر أحلام لاتنتمي إليك معلومه مفيده للمتزوجات,Negative
ذكريات لا تموت آخيرا سعاد تكلمت بادب,Negative
يا ليت الزمن يعود يوما,Negative
ليت سعد يقوم ويتركهم حياتك,Negative
لاتعاتب شخص حافظ عليك واهملته,Negative
إلهي أعني بالبكاء على نفسي,Negative
اشتقت لناس كثير بتويتر يالله افتكر رمضان اللي فات مسرع مرت سنه وانا معد ادري فين الله حاطهم,Negative
الحب حياة عندما يحضر الوفاء الحب لهيب عندما يغيب الوفاء,Negative
يافارج الهم وكاشف الغم فرج هم أختي ويسر أمرها وأرزقها من حيث لاتحتسب وكل من قال آمين,Negative
من فرقاك لليوم مامر علي نوم,Negative
يارب ارحم ضعفي و قلة حيلتي,Negative
ينفع انام شوية وبعدين اقوم اخرج لا كنت عارفة إنه لا,Negative
حسبي الله علقت بمخي أغنية فطن,Negative
أختك هي جزء رقيق من قلبك فكن بجانبها لكي لا تكسرها الحياة ابكتني,Negative
مشكله لما تشتاق لشخص ميت,Negative
الطفل العراقي قصيدة مؤثرة إلقاء أخيكم محمد فخرو,Negative
اقوى نهايه ارك غير متوقعه كانت ارك النمل في هنتر,Negative
ولكنني لما رأيتك راحلا بكيت دما حتى بللت به الثرى كارينيو,Negative
الصبر صفة جيده لكن سيئه جدا ل المشتاقين,Negative
كيف احط كوكيز ف المطبخ واروح واخليه بروحه كيف,Negative
انا مبتليه بصديقات الله لايبلي مسلم مثلهم,Negative
للاسف قمة الكالتشيو بين اليوفي ونابولي في نفس توقيت مباراة برشلونة,Negative
للحين تتحت تأثيرها كنت فاقدة الامل انها تعرف من جودت,Negative
اربح مع الامتياز يارب ارزقني الفوز وانت خير الرازقين,Negative
بلغت فرحة تعليق الدراسة من قلوبنا مبلغا كبيرا ولم يعنها أمر الريح في شيء مع أنها كانت عذابا على قوم د مشعل الفلاحي,Negative
في ناس تصارع في الحياة وانا نصارع في سني,Negative
الوسادة تحمل رأس الغني والفقير والصغير والكبير والحارس والأمير لكن لا ينام عليها بعمق الا مرتاح الضمير,Negative
صباح اخر يوم في الكويت الحبيبة,Negative
يا لحبنا هذا كيف اتى و رحل,Negative
خرزامة النواميس نوم عيني يال بريك,Negative
الشوارع تمتلئ بمزيج من السرسجية مع الاندر ايدج,Negative
من ناحيتي انتظر الأسطورة لكن للأسف تأخرت كثير,Negative
لما انسى كتبي اب ويسكرون,Negative
يارب أرح نفوسا تتألم ولا تتكلم,Negative
النسيان هو فن الحياة السعيدة,Negative
ربنا يصبر كل شخص فقد أمه وان شاء الله اكيد في مكان احسن,Negative
عدنا للسهر والعمل ليلا,Negative
مره كتبت ذنب أني خلقت امرأة ونشأت داخل القطيع أقتات على حلم بسيط وعصا الراعي تهش على ساقي,Negative
لست حزينة لكن روحي ممتلئة بالبكاء,Negative
لحظة غضب قد تجعلك تخسر كل شيء فكر قبل أن تطلق العنان لعصبيتك وتعلم فن ادارة العضب,Negative
عند النوم يبدأ حفل زفاف الذكريات,Negative
لو تسمعون صوتي وانا اغني بتعرفون وقتها ليه الأغاني حرام,Negative
احلي بلوك في الكوكب رمضان,Negative
يارب احل في الكويز و يارب انجح,Negative
السلام عليكم السخانه كيفك والله سخانة بس الاخبار الحر الحر الجديد كتمة م طبيعية والله,Negative
صباح اخر يوم اختبار والله يجعل ختامها مسك,Negative
منابر الشآم تفتقدك الذكرى الرابعة لاستشهاد شهيد المنابر العلامة محمد سعيد رمضان البوطي الرحمة والسلام لروحك,Negative
عندي احساس في داخلي انه نهائي الكاس بين الاهلي والتعاون,Negative
ربي لا تختبر إيماننا بفقد يؤلم قلوبنا,Negative
و لا احد انا نفسي ما اثق فيها ثقة عمياء,Negative
يارب عوضنا عن كل حاجة فقدناها خير,Negative
أشبعني قربا غدا سيأخذني القدر دون أن أودعك,Negative
ثم إن قلبي يخاف عليك من أدنى وجع,Negative
الناس عندهم حب اقل شي الا انا وياك حتى مو لاقين لاكن الله لنا,Negative
انتيهوا لأطفالكم سيسألكم الرحمن عنهم,Negative
اكبر مبلغ قد صار بحسابك الف ريال سعودي قبل سنوات,Negative
جعل من يكسر خواطر نظيفين القلوب ينكسر قلبه ويبطي مايلقا له دواء,Negative
بعدها تكذب يا نظر عيني تقول اني عن الناس أكافيك,Negative
الصحبه الحقيقه هي الي كلكم تكرهون نفس الاشخاص,Negative
لن تكون مثل سهره سرور ولن يكونو كريلتي هاني حياتك,Negative
لما أدز سناب و أنا أغني,Negative
لا تنزل الدموع إلا على الغالين فقط,Negative
لمن اضيع وقتي وانا اكتب الورقه البحثيه,Negative
الساعه كنت اريد السوار احلى,Negative
صعبة من بعد المحبه يلقى قلبك من تحبه,Negative
للأمانه الآيات في القرآن سببت لي حيرة وحيرة وصلت للشك وقال تعالى سنريهم آياتنا في الآفاق وفي أنفسهم حتى يتبين لهم أنه الحق,Negative
دايما اقول اخر اسبوعين اصعب اسبوعين,Negative
اقسم بالله اني اكره الصوت الحاد,Negative
الحمدلله حمدا تطيب به النعم,Negative
المذاكره ل آخر ماده هي الإختبار الحقيقي صعب مره مره الله يوفقني وإياكم,Negative
حياتك لا انا ضد افكر ب الاجابه ولا الاكل,Negative
الحلم هو عبارة عن مجموعة مم الصور عن المستقبل وواقع نرسمه في الخيال,Negative
وانا أفكره انه عن المسلسل ذكريات لا تموت,Negative
اصعب شعور في هذه الدنيا ان تكون متوفي وانت ع قيدها فرحتك بألم وضحكتك بوجع الله يرحمك يا أمي,Negative
فيء ظلام ء الليل ء ي كثر ء الموآجع ء ذكريآإت ء أحزان ء وأشواق ء السنين ء,Negative
انا اتعب لي متى ما احكي في سيرته الدنيا غيرته خلاص مافي داعي,Negative
ياثقل سرور ياربي كيف كذا دمعته ولا طرفت حتى,Negative
سنة رابعة والحبر والطباشير والاوراق,Negative
عاشر من الناس كبار العقول و جانب الجهال أهل الفضول واشرب نقيع السم من عاقل واسكب علي الأرض دواء الجهول الخيام,Negative
كمية الإزعاج في أغنية مرني بصوت الجسمي لا توصف,Negative
والله هذا ما صار عليها يومين أأخ من الندم يعور,Negative
الأمور ليست على ما يرام باجر دوام,Negative
فقيدتي النائمه ها قد مضى سنة واربع أشهر على فراقك غفر الله لك وأسكنك الجنة التي وعد بها المتقون,Negative
لا تثق ب أحد كثيرا تذكر ان الشيطان كان من الملائكة,Negative
بئسا للذي ينظر عيوبك بعين صقر وينظر الى محاسنك بعين الكفيف,Negative
رضيت ب الغياب و لكن الذكري لم ترضي ب الرحيل,Negative
اقوى موقف محرج في قناة بداية وفي برامج الواقع حياتك,Negative
وكأن الذكريات لا تنبض الا ليلا,Negative
إن شفتني مع غيرك لا تتضايق تذكر إني كنت أبيك واهملتني,Negative
اذكرو آبوي بدعوه تسعده في قبره لعل احدكم اقرب الى الله مني منزله,Negative
وكنت اتمني ان الوقت الذي يمر بهذا السرعه يكون معك وحدك,Negative
مصدعه ماقادره اذاكر اريد شاي موده,Negative
كن صامتا لا تبلى حسنا او سوءا,Negative
ظروف بعض البشر مدفونه في أعماقهم فإن لم تعرفها فأكرمهم بحسن الظن,Negative
ه احبهم كل ما اشوفه اصيح من الضحك اكثر من قبل,Negative
كيف حال قلبك يسأل الله الاستقامة قبل توقف نبضه,Negative
تذكرت مقولة ابن تيميه ما يفعل أعدائي بي أنا جنتي و بستاني في صدري فرج الله عنه حميدان التركي يحكي بدموعه,Negative
الاربعاء كانت مباراة حاسمة اليوم مباراة حاسمة اعصابي خلصت,Negative
